{
  "schemaVersion": "1.0.0",
  "auditId": "PVEA-SYNTHETIC-001",
  "candidate": {
    "candidateId": "synthetic-candidate-001",
    "artifactPath": "candidate.mp4",
    "sha256": "aaaaaaaaaaaaaaaaaaaaaaaaaaaaaaaaaaaaaaaaaaaaaaaaaaaaaaaaaaaaaaaa",
    "bytes": 23,
    "sourceRevision": "synthetic-revision-001",
    "renderProvenanceId": "synthetic-render-001"
  },
  "auditor": {
    "role": "orchestrator",
    "contextId": "orchestrator-editorial-audit-001"
  },
  "fullPlayback": {
    "continuous": true,
    "mediaDurationSeconds": 45,
    "startedAt": "2026-07-29T15:00:00.000Z",
    "completedAt": "2026-07-29T15:01:00.000Z"
  },
  "phaseChecks": [
    { "phase": "opening-promise", "passed": true, "evidence": [{ "kind": "frame-timestamp", "candidateSha256": "aaaaaaaaaaaaaaaaaaaaaaaaaaaaaaaaaaaaaaaaaaaaaaaaaaaaaaaaaaaaaaaa", "timestampSeconds": 0.5, "frameSha256": "ffffffffffffffffffffffffffffffffffffffffffffffffffffffffffffffff" }] },
    { "phase": "transitions-and-focus", "passed": true, "evidence": [{ "kind": "frame-timestamp", "candidateSha256": "aaaaaaaaaaaaaaaaaaaaaaaaaaaaaaaaaaaaaaaaaaaaaaaaaaaaaaaaaaaaaaaa", "timestampSeconds": 5, "frameSha256": "ffffffffffffffffffffffffffffffffffffffffffffffffffffffffffffffff" }] },
    { "phase": "hero-before-action-result", "passed": true, "evidence": [{ "kind": "frame-timestamp", "candidateSha256": "aaaaaaaaaaaaaaaaaaaaaaaaaaaaaaaaaaaaaaaaaaaaaaaaaaaaaaaaaaaaaaaa", "timestampSeconds": 12, "frameSha256": "ffffffffffffffffffffffffffffffffffffffffffffffffffffffffffffffff" }] },
    { "phase": "screen-cleanliness", "passed": true, "evidence": [{ "kind": "frame-timestamp", "candidateSha256": "aaaaaaaaaaaaaaaaaaaaaaaaaaaaaaaaaaaaaaaaaaaaaaaaaaaaaaaaaaaaaaaa", "timestampSeconds": 18, "frameSha256": "ffffffffffffffffffffffffffffffffffffffffffffffffffffffffffffffff" }] },
    { "phase": "responsive-legibility", "passed": true, "evidence": [{ "kind": "frame-timestamp", "candidateSha256": "aaaaaaaaaaaaaaaaaaaaaaaaaaaaaaaaaaaaaaaaaaaaaaaaaaaaaaaaaaaaaaaa", "timestampSeconds": 24, "frameSha256": "ffffffffffffffffffffffffffffffffffffffffffffffffffffffffffffffff" }] },
    { "phase": "cta-and-impact", "passed": true, "evidence": [{ "kind": "frame-timestamp", "candidateSha256": "aaaaaaaaaaaaaaaaaaaaaaaaaaaaaaaaaaaaaaaaaaaaaaaaaaaaaaaaaaaaaaaa", "timestampSeconds": 36, "frameSha256": "ffffffffffffffffffffffffffffffffffffffffffffffffffffffffffffffff" }] },
    { "phase": "stable-final-hold", "passed": true, "evidence": [{ "kind": "frame-timestamp", "candidateSha256": "aaaaaaaaaaaaaaaaaaaaaaaaaaaaaaaaaaaaaaaaaaaaaaaaaaaaaaaaaaaaaaaa", "timestampSeconds": 43, "frameSha256": "ffffffffffffffffffffffffffffffffffffffffffffffffffffffffffffffff" }] }
  ],
  "findings": [],
  "status": "PASS",
  "generatedAt": "2026-07-29T15:01:00.000Z"
}
